create database employee_payroll_service;

mysql> show databases;
+--------------------------+
| Database                 |
+--------------------------+
| addressbook_service      |
| employee_payroll_service |
| information_schema       |
| mysql                    |
| performance_schema       |
| sakila                   |
| sys                      |
| world                    |
+--------------------------+
8 rows in set (0.21 sec)

mysql> use employee_payroll_service
Database changed

mysql> create table employee_payroll(
    -> ID int(3) NOT NULL auto_increment,
    -> Name varchar(20) NOT NULL,
    -> Salary double NOT NULL,
    -> Start_Date Date NOT NULL
    -> ,Primary Key(ID)
    -> );
Query OK, 0 rows affected, 1 warning (3.07 sec)

mysql> insert into employee_payroll(Name,Salary,Start_Date) values('Akshat Gupta',320000,'2020-09-12');
Query OK, 1 row affected (0.20 sec)

mysql> describe employee_payroll
    -> ;
+------------+-------------+------+-----+---------+----------------+
| Field      | Type        | Null | Key | Default | Extra          |
+------------+-------------+------+-----+---------+----------------+
| ID         | int         | NO   | PRI | NULL    | auto_increment |
| Name       | varchar(20) | NO   |     | NULL    |                |
| Salary     | double      | NO   |     | NULL    |                |
| Start_Date | date        | NO   |     | NULL    |                |
+------------+-------------+------+-----+---------+----------------+
4 rows in set (0.26 sec)

mysql> insert into employee_payroll(Name,Salary,Start_Date) values('Amrinder Brar',450000,'2020-03-14');
Query OK, 1 row affected (0.17 sec)

mysql> insert into employee_payroll(Name,Salary,Start_Date) values('Ammy Virk',60000,'2020-03-19');
Query OK, 1 row affected (0.10 sec)

mysql> select * from employee_payroll
    -> ;
+----+---------------+--------+------------+
| ID | Name          | Salary | Start_Date |
+----+---------------+--------+------------+
|  1 | Akshat Gupta  | 320000 | 2020-09-12 |
|  2 | Amrinder Brar | 450000 | 2020-03-14 |
|  3 | Ammy Virk     |  60000 | 2020-03-19 |
+----+---------------+--------+------------+
3 rows in set (0.00 sec)


mysql> select * from employee_payroll where name = 'Akshat Gupta';
+----+--------------+--------+------------+
| ID | Name         | Salary | Start_Date |
+----+--------------+--------+------------+
|  1 | Akshat Gupta | 320000 | 2020-09-12 |
+----+--------------+--------+------------+
1 row in set (0.00 sec)


mysql> select * from employee_payroll where start_date between CAST('2020-03-17' as date) and date(now());
+----+--------------+--------+------------+
| ID | Name         | Salary | Start_Date |
+----+--------------+--------+------------+
|  1 | Akshat Gupta | 320000 | 2020-09-12 |
|  3 | Ammy Virk    |  60000 | 2020-03-19 |
+----+--------------+--------+------------+
2 rows in set (0.05 sec)


mysql> insert into employee_payroll(Name,Salary,Start_Date) values('Neha Kakkar',60000,'2020-05-11');
Query OK, 1 row affected (0.41 sec)

mysql> alter table employee_payroll
    -> add Gender varchar(15) Not Null default 'Other';
Query OK, 0 rows affected (2.17 sec)
Records: 0  Duplicates: 0  Warnings: 0

mysql> select * from employee_payroll;
+----+---------------+--------+------------+--------+
| ID | Name          | Salary | Start_Date | Gender |
+----+---------------+--------+------------+--------+
|  1 | Akshat Gupta  | 320000 | 2020-09-12 | Other  |
|  2 | Amrinder Brar | 450000 | 2020-03-14 | Other  |
|  3 | Ammy Virk     |  60000 | 2020-03-19 | Other  |
|  4 | Neha Kakkar   |  60000 | 2020-05-11 | Other  |
+----+---------------+--------+------------+--------+
4 rows in set (0.00 sec)


mysql> Update employee_payroll set
    -> gender = 'Male' where Name in ('Akshat Gupta','Amrinder Brar','Ammy Virk');
Query OK, 3 rows affected (0.16 sec)
Rows matched: 3  Changed: 3  Warnings: 0

mysql> Update employee_payroll set
    -> gender = 'Female' where Name = 'Neha Kakkar';
Query OK, 1 row affected (0.15 sec)
Rows matched: 1  Changed: 1  Warnings: 0


mysql> select * from employee_payroll;
+----+---------------+--------+------------+--------+
| ID | Name          | Salary | Start_Date | Gender |
+----+---------------+--------+------------+--------+
|  1 | Akshat Gupta  | 320000 | 2020-09-12 | Male   |
|  2 | Amrinder Brar | 450000 | 2020-03-14 | Male   |
|  3 | Ammy Virk     |  60000 | 2020-03-19 | Male   |
|  4 | Neha Kakkar   |  60000 | 2020-05-11 | Female |
+----+---------------+--------+------------+--------+
4 rows in set (0.00 sec)

mysql> select max(salary) as Salary from employee_payroll;
+--------+
| Salary |
+--------+
| 450000 |
+--------+
1 row in set (0.00 sec)

mysql> select min(salary) as Salary from employee_payroll;
+--------+
| Salary |
+--------+
|  60000 |
+--------+
1 row in set (0.00 sec)

mysql> select avg(salary) as Average_Salary from employee_payroll;
+----------------+
| Average_Salary |
+----------------+
|         222500 |
+----------------+
1 row in set (0.00 sec)

mysql> select sum(salary) as sum_of_salaries from employee_payroll;
+-----------------+
| sum_of_salaries |
+-----------------+
|          890000 |
+-----------------+
1 row in set (0.00 sec)

mysql> select count(gender) from employee_payroll where gender = 'Male';
+---------------+
| count(gender) |
+---------------+
|             3 |
+---------------+
1 row in set (0.00 sec)

mysql> select gender,sum(salary) from employee_payroll group by gender;
+--------+-------------+
| gender | sum(salary) |
+--------+-------------+
| Male   |      830000 |
| Female |       60000 |
+--------+-------------+
2 rows in set (0.00 sec)

mysql> alter table employee_payroll
    -> add column Phone_number double default 9876543210 not null;
Query OK, 0 rows affected (1.73 sec)
Records: 0  Duplicates: 0  Warnings: 0

mysql> alter table employee_payroll
    -> add column department varchar(20) default 'Managing' not null,
    -> add column address varchar(30) default 'Pitampura' not null;
Query OK, 0 rows affected (0.78 sec)
Records: 0  Duplicates: 0  Warnings: 0


mysql> alter table employee_payroll
    -> add column basic_pay double default 0 not null,
    -> add column deductions double default 0 not null,
    -> add column taxable_pay double default 0 not null,
    -> add column income_tax double default 0 not null,
    -> add column net_pay double default 0 not null;
Query OK, 0 rows affected (0.53 sec)
Records: 0  Duplicates: 0  Warnings: 0

mysql> select * from employee_payroll
    -> ;
+----+---------------+--------+------------+--------+--------------+------------+-----------+-----------+------------+-------------+------------+---------+
| ID | Name          | Salary | Start_Date | Gender | Phone_number | department | address   | basic_pay | deductions | taxable_pay | income_tax | net_pay |
+----+---------------+--------+------------+--------+--------------+------------+-----------+-----------+------------+-------------+------------+---------+
|  1 | Akshat Gupta  | 320000 | 2020-09-12 | Male   |   9876543210 | Managing   | Pitampura |         0 |          0 |           0 |          0 |       0 |
|  2 | Amrinder Brar | 450000 | 2020-03-14 | Male   |   9876543210 | Managing   | Pitampura |         0 |          0 |           0 |          0 |       0 |
|  3 | Ammy Virk     |  60000 | 2020-03-19 | Male   |   9876543210 | Managing   | Pitampura |         0 |          0 |           0 |          0 |       0 |
|  4 | Neha Kakkar   |  60000 | 2020-05-11 | Female |   9876543210 | Managing   | Pitampura |         0 |          0 |           0 |          0 |       0 |
+----+---------------+--------+------------+--------+--------------+------------+-----------+-----------+------------+-------------+------------+---------+
4 rows in set (0.05 sec)



mysql> insert into employee_payroll(name,salary,start_date,gender,phone_number,department,address,basic_pay,deductions,taxable_pay,income_tax,net_pay)
    -> values ('Terisa',32000,'2020-06-03','Male',9876543210,'Sales','Navi Mumbai',0,0,0,0,0);
Query OK, 1 row affected (0.11 sec)

mysql> insert into employee_payroll(name,salary,start_date,gender,phone_number,department,address,basic_pay,deductions,taxable_pay,income_tax,net_pay)
    -> values ('Terisa',32000,'2020-06-03','Male',9876543210,'Marketing','Navi Mumbai',0,0,0,0,0);
Query OK, 1 row affected (0.14 sec)

mysql> select * from employee_payroll;
+----+---------------+--------+------------+--------+--------------+------------+-------------+-----------+------------+-------------+------------+---------+
| ID | Name          | Salary | Start_Date | Gender | Phone_number | department | address     | basic_pay | deductions | taxable_pay | income_tax | net_pay |
+----+---------------+--------+------------+--------+--------------+------------+-------------+-----------+------------+-------------+------------+---------+
|  1 | Akshat Gupta  | 320000 | 2020-09-12 | Male   |   9876543210 | Managing   | Pitampura   |         0 |          0 |           0 |          0 |       0 |
|  2 | Amrinder Brar | 450000 | 2020-03-14 | Male   |   9876543210 | Managing   | Pitampura   |         0 |          0 |           0 |          0 |       0 |
|  3 | Ammy Virk     |  60000 | 2020-03-19 | Male   |   9876543210 | Managing   | Pitampura   |         0 |          0 |           0 |          0 |       0 |
|  4 | Neha Kakkar   |  60000 | 2020-05-11 | Female |   9876543210 | Managing   | Pitampura   |         0 |          0 |           0 |          0 |       0 |
|  5 | Terisa        |  32000 | 2020-06-03 | Male   |   9876543210 | Sales      | Navi Mumbai |         0 |          0 |           0 |          0 |       0 |
|  6 | Terisa        |  32000 | 2020-06-03 | Male   |   9876543210 | Marketing  | Navi Mumbai |         0 |          0 |           0 |          0 |       0 |
+----+---------------+--------+------------+--------+--------------+------------+-------------+-----------+------------+-------------+------------+---------+
6 rows in set (0.00 sec)

mysql> update employee_payroll set gender = 'Female' where Name = 'Terisa';
Query OK, 2 rows affected (0.09 sec)
Rows matched: 2  Changed: 2  Warnings: 0

mysql> select * from employee_payroll;
+----+---------------+--------+------------+--------+--------------+------------+-------------+-----------+------------+-------------+------------+---------+
| ID | Name          | Salary | Start_Date | Gender | Phone_number | department | address     | basic_pay | deductions | taxable_pay | income_tax | net_pay |
+----+---------------+--------+------------+--------+--------------+------------+-------------+-----------+------------+-------------+------------+---------+
|  1 | Akshat Gupta  | 320000 | 2020-09-12 | Male   |   9876543210 | Managing   | Pitampura   |         0 |          0 |           0 |          0 |       0 |
|  2 | Amrinder Brar | 450000 | 2020-03-14 | Male   |   9876543210 | Managing   | Pitampura   |         0 |          0 |           0 |          0 |       0 |
|  3 | Ammy Virk     |  60000 | 2020-03-19 | Male   |   9876543210 | Managing   | Pitampura   |         0 |          0 |           0 |          0 |       0 |
|  4 | Neha Kakkar   |  60000 | 2020-05-11 | Female |   9876543210 | Managing   | Pitampura   |         0 |          0 |           0 |          0 |       0 |
|  5 | Terisa        |  32000 | 2020-06-03 | Female |   9876543210 | Sales      | Navi Mumbai |         0 |          0 |           0 |          0 |       0 |
|  6 | Terisa        |  32000 | 2020-06-03 | Female |   9876543210 | Marketing  | Navi Mumbai |         0 |          0 |           0 |          0 |       0 |
+----+---------------+--------+------------+--------+--------------+------------+-------------+-----------+------------+-------------+------------+---------+
6 rows in set (0.00 sec)

-----------------------------------------------------------------------------------------------------------------------------------------
//Reopening the client


mysql> show databases;
+--------------------------+
| Database                 |
+--------------------------+
| addressbook_service      |
| employee_payroll_service |
| information_schema       |
| mysql                    |
| performance_schema       |
| sakila                   |
| sys                      |
| world                    |
+--------------------------+
8 rows in set (0.01 sec)

mysql> use employee_payroll_service
Database changed


mysql> show tables;
+------------------------------------+
| Tables_in_employee_payroll_service |
+------------------------------------+
| employee_payroll                   |
+------------------------------------+
1 row in set (0.00 sec)

mysql> select * from employee_payroll;
+----+---------------+--------+------------+--------+--------------+------------+-------------+-----------+------------+-------------+------------+---------+
| ID | Name          | Salary | Start_Date | Gender | Phone_number | department | address     | basic_pay | deductions | taxable_pay | income_tax | net_pay |
+----+---------------+--------+------------+--------+--------------+------------+-------------+-----------+------------+-------------+------------+---------+
|  1 | Akshat Gupta  | 320000 | 2020-09-12 | Male   |   9876543210 | Managing   | Pitampura   |         0 |          0 |           0 |          0 |       0 |
|  2 | Amrinder Brar | 450000 | 2020-03-14 | Male   |   9876543210 | Managing   | Pitampura   |         0 |          0 |           0 |          0 |       0 |
|  3 | Ammy Virk     |  60000 | 2020-03-19 | Male   |   9876543210 | Managing   | Pitampura   |         0 |          0 |           0 |          0 |       0 |
|  4 | Neha Kakkar   |  60000 | 2020-05-11 | Female |   9876543210 | Managing   | Pitampura   |         0 |          0 |           0 |          0 |       0 |
|  5 | Terisa        |  32000 | 2020-06-03 | Female |   9876543210 | Sales      | Navi Mumbai |         0 |          0 |           0 |          0 |       0 |
|  6 | Terisa        |  32000 | 2020-06-03 | Female |   9876543210 | Marketing  | Navi Mumbai |         0 |          0 |           0 |          0 |       0 |
+----+---------------+--------+------------+--------+--------------+------------+-------------+-----------+------------+-------------+------------+---------+
6 rows in set (0.00 sec)

mysql> create table Department(
    -> name varchar(20),
    -> address varchar(20)
    -> ,id varchar(20)
    -> );
Query OK, 0 rows affected (2.55 sec)

mysql> Alter table Department
    -> add Primary Key(id);
Query OK, 0 rows affected (1.86 sec)
Records: 0  Duplicates: 0  Warnings: 0

mysql> create table empId_departmentID(
    -> empID int,
    -> departmentID int);
Query OK, 0 rows affected (0.57 sec)

mysql> create table Employees(
    -> Employee_id int primary key,
    -> name varchar(30) not null default 'AiseHi',
    -> Salary double not null default 100000,
    -> Start_date date not null default '2020-01-06',
    -> gender varchar(20) not null default 'Female',
    -> Phone_number varchar(20) not null default 9876543210,
    -> Basic_pay double not null default 0,
    -> Deductions double not null default 0,
    -> Taxable_pay double not null default 0,
    -> Income_tax double not null default 0,
    -> Net_pay double not null default 0
    -> );
Query OK, 0 rows affected (0.55 sec)

mysql> alter table Employees
    -> MODIFY column phone_number double;
Query OK, 0 rows affected (2.54 sec)
Records: 0  Duplicates: 0  Warnings: 0

mysql> alter table department
    -> modify id int;
Query OK, 0 rows affected (3.04 sec)
Records: 0  Duplicates: 0  Warnings: 0

mysql> insert into department values ('Managing','Pitampura',1);
Query OK, 1 row affected (0.27 sec)

insert into Employees values(1,'Akshat Gupta',50000,'2020-09-21','Male',50000,30000,20000,3600,18400,1,9879879870);
Query OK, 1 row affected (0.16 sec)

mysql> alter table empid_departmentid
    -> add foreign key(empid) references employees(employee_id),
    -> add foreign key(departmentid) references department(id);
Query OK, 0 rows affected (3.46 sec)
Records: 0  Duplicates: 0  Warnings: 0

mysql> insert into empID_departmentId values (1,1);
Query OK, 1 row affected (0.13 sec)

mysql> insert into department values ('Managing','Navi Mumbai',2);
Query OK, 1 row affected (0.13 sec)

mysql> insert into department values ('Sales','Navi Mumbai',3);
Query OK, 1 row affected (0.07 sec)

mysql> insert into department values ('Marketing','Shahpura',4);
Query OK, 1 row affected (0.12 sec)

mysql> insert into Employees values(2,'Amrinder Brar',65000,'2020-09-21','Male',65000,25000,40000,7200,32800,9879873430);
Query OK, 1 row affected (0.14 sec)

insert into Employees values(3,'Ammy Virk',45000,'2020-09-21','Male',45000,25000,20000,3600,18400,9349873430);
Query OK, 1 row affected (0.16 sec)

mysql> insert into Employees values(4,'Neha Kakkar',450000,'2020-09-21','Female',450000,100000,350000,35000,315000,9859873430);
Query OK, 1 row affected (0.07 sec)

mysql> insert into Employees values(5,'Terisa',45000,'2020-09-21','Female',45000,25000,20000,3600,16400,9698873430);
Query OK, 1 row affected (0.17 sec)

mysql> insert into empID_departmentId values (2,1);
Query OK, 1 row affected (0.35 sec)

mysql> insert into empID_departmentId values (3,1);
Query OK, 1 row affected (0.12 sec)

mysql> insert into empID_departmentId values (4,2);
Query OK, 1 row affected (0.12 sec)

mysql> insert into empID_departmentId values (5,3);
Query OK, 1 row affected (0.14 sec)

mysql> insert into empID_departmentId values (5,4);
Query OK, 1 row affected (0.11 sec)

mysql> select employee_id,employees.name,department.name from employees,department,empid_departmentid
    -> where employee_id = empid and departmentid = id;
+-------------+---------------+-----------+
| employee_id | name          | name      |
+-------------+---------------+-----------+
|           1 | Akshat Gupta  | Managing  |
|           2 | Amrinder Brar | Managing  |
|           3 | Ammy Virk     | Managing  |
|           4 | Neha Kakkar   | Managing  |
|           5 | Terisa        | Sales     |
|           5 | Terisa        | Marketing |
+-------------+---------------+-----------+
6 rows in set (0.09 sec)

mysql> select * from employees,department,empid_departmentid
    -> where employee_id = empid and departmentid = id;
+-------------+---------------+--------+------------+--------+-----------+------------+-------------+------------+---------+--------------+-----------+-------------+----+-------+--------------+
| Employee_id | name          | Salary | Start_date | gender | Basic_pay | Deductions | Taxable_pay | Income_tax | Net_pay | phone_number | name      | address     | id | empID | departmentID |
+-------------+---------------+--------+------------+--------+-----------+------------+-------------+------------+---------+--------------+-----------+-------------+----+-------+--------------+
|           1 | Akshat Gupta  |  50000 | 2020-09-21 | Male   |     50000 |      30000 |       20000 |       3600 |   18400 |   9879879870 | Managing  | Pitampura   |  1 |     1 |            1 |
|           2 | Amrinder Brar |  65000 | 2020-09-21 | Male   |     65000 |      25000 |       40000 |       7200 |   32800 |   9879873430 | Managing  | Pitampura   |  1 |     2 |            1 |
|           3 | Ammy Virk     |  45000 | 2020-09-21 | Male   |     45000 |      25000 |       20000 |       3600 |   18400 |   9349873430 | Managing  | Pitampura   |  1 |     3 |            1 |
|           4 | Neha Kakkar   | 450000 | 2020-09-21 | Female |    450000 |     100000 |      350000 |      35000 |  315000 |   9859873430 | Managing  | Navi Mumbai |  2 |     4 |            2 |
|           5 | Terisa        |  45000 | 2020-09-21 | Female |     45000 |      25000 |       20000 |       3600 |   16400 |   9698873430 | Sales     | Navi Mumbai |  3 |     5 |            3 |
|           5 | Terisa        |  45000 | 2020-09-21 | Female |     45000 |      25000 |       20000 |       3600 |   16400 |   9698873430 | Marketing | Shahpura    |  4 |     5 |            4 |
+-------------+---------------+--------+------------+--------+-----------+------------+-------------+------------+---------+--------------+-----------+-------------+----+-------+--------------+
6 rows in set (0.00 sec)

mysql> select gender,count(gender) from employees group by gender;
+--------+---------------+
| gender | count(gender) |
+--------+---------------+
| Male   |             3 |
| Female |             2 |
+--------+---------------+
2 rows in set (0.07 sec)


mysql> select gender,sum(salary) from employees group by gender;
+--------+-------------+
| gender | sum(salary) |
+--------+-------------+
| Male   |      160000 |
| Female |      495000 |
+--------+-------------+
2 rows in set (0.05 sec)

mysql> select gender,avg(salary) from employees group by gender;
+--------+--------------------+
| gender | avg(salary)        |
+--------+--------------------+
| Male   | 53333.333333333336 |
| Female |             247500 |
+--------+--------------------+
2 rows in set (0.07 sec)

mysql> select gender,min(salary) from employees group by gender;
+--------+-------------+
| gender | min(salary) |
+--------+-------------+
| Male   |       45000 |
| Female |       45000 |
+--------+-------------+
2 rows in set (0.07 sec)

mysql> select gender,max(salary) from employees group by gender;
+--------+-------------+
| gender | max(salary) |
+--------+-------------+
| Male   |       65000 |
| Female |      450000 |
+--------+-------------+
2 rows in set (0.00 sec)

